{
  "attempt_id": "eb639d03-110b-4255-b938-c5e9edff309c",
  "candidate_id": "kimi-cli-kimi-k2.5-24ae8482-54c6-4ff6-869a-e737c2ad2917",
  "capabilities": [
    "read",
    "write",
    "execute_with_consent",
    "audit",
    "suggest"
  ],
  "certificate_id": "CERT-91a32766",
  "issued_at": "2026-04-09T01:20:51.562800+00:00",
  "score_hash": "d30a01f639d09ebec852dc4e91db53e62ce9fb79b21e8e8456f1e35ce33a3cd0",
  "signature": "oe-sig-94959b6532cab3de",
  "transcript_hash": "81ab23d926f81cfb38aaac9445f4dff6e00d33ac884a391c00bddd72b41662df",
  "witness_entry_id": "51a39652f0c430f8739fe7e247f1043dcce4e46050d7ddeaaaba2fbb8b597b4b"
}